results/e2e_2026-05-22/config_sweep.csv
variant,seqlen,BLOCK_M,BLOCK_N,num_warps,num_stages,latency_ms
dense,512,64,32,4,3,0.0717
dense,512,64,64,4,3,0.0911
dense,512,64,128,4,2,0.0942
dense,512,64,128,8,2,0.1439
dense,512,128,32,4,4,0.0963
dense,512,128,32,8,3,0.0901
dense,512,128,64,4,3,0.0973
dense,512,128,64,8,2,0.0901
dense,512,128,128,4,2,0.0983
dense,512,128,128,8,2,0.0952
dense,1024,64,32,4,3,0.2437
dense,1024,64,64,4,3,0.2447
dense,1024,64,128,4,2,0.2540
dense,1024,64,128,8,2,0.5294
dense,1024,128,32,4,4,0.2534
dense,1024,128,32,8,3,0.2130
dense,1024,128,64,4,3,0.2463
dense,1024,128,64,8,2,0.2068
dense,1024,128,128,4,2,0.2499
dense,1024,128,128,8,2,0.2519
dense,2048,64,32,4,3,0.7808
dense,2048,64,64,4,3,0.8218
dense,2048,64,128,4,2,0.8274
dense,2048,64,128,8,2,1.7705
dense,2048,128,32,4,4,0.9313
dense,2048,128,32,8,3,0.7916
dense,2048,128,64,4,3,0.9272
dense,2048,128,64,8,2,0.7741
dense,2048,128,128,4,2,0.9257
dense,2048,128,128,8,2,0.9533
dense,4096,64,32,4,3,3.3485
dense,4096,64,64,4,3,3.3249
dense,4096,64,128,4,2,3.3833
dense,4096,64,128,8,2,7.0354
dense,4096,128,32,4,4,3.5364
dense,4096,128,32,8,3,3.1744
dense,4096,128,64,4,3,3.4847
dense,4096,128,64,8,2,3.0843
dense,4096,128,128,4,2,3.4580
dense,4096,128,128,8,2,3.5999
causal,512,64,32,4,3,0.0911
causal,512,64,64,4,3,0.0891
causal,512,64,128,4,2,0.0911
causal,512,64,128,8,2,0.1034
causal,512,128,32,4,4,0.0942
causal,512,128,32,8,3,0.0922
causal,512,128,64,4,3,0.0952
causal,512,128,64,8,2,0.0932
causal,512,128,128,4,2,0.0881
causal,512,128,128,8,2,0.0870
causal,1024,64,32,4,3,0.1526
causal,1024,64,64,4,3,0.1628
causal,1024,64,128,4,2,0.1669
causal,1024,64,128,8,2,0.3174
causal,1024,128,32,4,4,0.2022
causal,1024,128,32,8,3,0.1772
causal,1024,128,64,4,3,0.2048
causal,1024,128,64,8,2,0.1782
causal,1024,128,128,4,2,0.2028
causal,1024,128,128,8,2,0.1782
causal,2048,64,32,4,3,0.4936
causal,2048,64,64,4,3,0.5458
causal,2048,64,128,4,2,0.5437
causal,2048,64,128,8,2,1.0783
causal,2048,128,32,4,4,0.5530
causal,2048,128,32,8,3,0.4823
causal,2048,128,64,4,3,0.5939
causal,2048,128,64,8,2,0.4900
causal,2048,128,128,4,2,0.5560
causal,2048,128,128,8,2,0.5089
causal,4096,64,32,4,3,1.7925
causal,4096,64,64,4,3,1.8954
causal,4096,64,128,4,2,1.8683
causal,4096,64,128,8,2,3.6762
causal,4096,128,32,4,4,1.9871
causal,4096,128,32,8,3,1.8028
causal,4096,128,64,4,3,1.9471
causal,4096,128,64,8,2,1.8028
causal,4096,128,128,4,2,1.9835
causal,4096,128,128,8,2,1.8898
sw_w256,512,64,32,4,3,0.0932
sw_w256,512,64,64,4,3,0.0753
sw_w256,512,64,128,4,2,0.0937
sw_w256,512,64,128,8,2,0.1321
sw_w256,512,128,32,4,4,0.0901
sw_w256,512,128,32,8,3,0.0957
sw_w256,512,128,64,4,3,0.0932
sw_w256,512,128,64,8,2,0.0932
sw_w256,512,128,128,4,2,0.0932
sw_w256,512,128,128,8,2,0.0901
sw_w256,1024,64,32,4,3,0.1270
sw_w256,1024,64,64,4,3,0.1321
sw_w256,1024,64,128,4,2,0.1495
sw_w256,1024,64,128,8,2,0.2908
sw_w256,1024,128,32,4,4,0.1792
sw_w256,1024,128,32,8,3,0.1464
sw_w256,1024,128,64,4,3,0.1720
sw_w256,1024,128,64,8,2,0.1710
sw_w256,1024,128,128,4,2,0.1853
sw_w256,1024,128,128,8,2,0.1669
sw_w256,2048,64,32,4,3,0.2468
sw_w256,2048,64,64,4,3,0.2611
sw_w256,2048,64,128,4,2,0.2980
sw_w256,2048,64,128,8,2,0.5975
sw_w256,2048,128,32,4,4,0.3251
sw_w256,2048,128,32,8,3,0.2785
sw_w256,2048,128,64,4,3,0.3144
sw_w256,2048,128,64,8,2,0.3389
sw_w256,2048,128,128,4,2,0.3000
sw_w256,2048,128,128,8,2,0.2918
sw_w256,4096,64,32,4,3,0.4352
sw_w256,4096,64,64,4,3,0.4741
sw_w256,4096,64,128,4,2,0.5724
sw_w256,4096,64,128,8,2,1.0977
sw_w256,4096,128,32,4,4,0.5668
sw_w256,4096,128,32,8,3,0.4864
sw_w256,4096,128,64,4,3,0.5540
sw_w256,4096,128,64,8,2,0.6021
sw_w256,4096,128,128,4,2,0.5862
sw_w256,4096,128,128,8,2,0.5960
causal_alibi,512,64,32,4,3,0.0947
causal_alibi,512,64,64,4,3,0.0942
causal_alibi,512,64,128,4,2,0.0937
causal_alibi,512,64,128,8,2,0.1075
causal_alibi,512,128,32,4,4,0.0952
causal_alibi,512,128,32,8,3,0.0911
causal_alibi,512,128,64,4,3,0.0916
causal_alibi,512,128,64,8,2,0.0942
causal_alibi,512,128,128,4,2,0.0911
causal_alibi,512,128,128,8,2,0.0911
causal_alibi,1024,64,32,4,3,0.1495
causal_alibi,1024,64,64,4,3,0.1659
causal_alibi,1024,64,128,4,2,0.1659
causal_alibi,1024,64,128,8,2,0.3328
causal_alibi,1024,128,32,4,4,0.2089
causal_alibi,1024,128,32,8,3,0.1756
causal_alibi,1024,128,64,4,3,0.2161
causal_alibi,1024,128,64,8,2,0.1838
causal_alibi,1024,128,128,4,2,0.2161
causal_alibi,1024,128,128,8,2,0.1956
causal_alibi,2048,64,32,4,3,0.4884
causal_alibi,2048,64,64,4,3,0.5514
causal_alibi,2048,64,128,4,2,0.5396
causal_alibi,2048,64,128,8,2,1.1392
causal_alibi,2048,128,32,4,4,0.5637
causal_alibi,2048,128,32,8,3,0.4869
causal_alibi,2048,128,64,4,3,0.5796
causal_alibi,2048,128,64,8,2,0.4997
causal_alibi,2048,128,128,4,2,0.5970
causal_alibi,2048,128,128,8,2,0.5468
causal_alibi,4096,64,32,4,3,1.7997
causal_alibi,4096,64,64,4,3,1.9185
causal_alibi,4096,64,128,4,2,1.8842
causal_alibi,4096,64,128,8,2,3.8707
causal_alibi,4096,128,32,4,4,2.0449
causal_alibi,4096,128,32,8,3,1.8033
causal_alibi,4096,128,64,4,3,2.0516
causal_alibi,4096,128,64,8,2,1.8575
causal_alibi,4096,128,128,4,2,2.0828
causal_alibi,4096,128,128,8,2,2.0070
